{
  "$schema": "https://schemas.metaframework.dev/metaframework/product/specification/datamodel/state-machine-document",
  "id": "authorization-check",
  "initial": "anonymous",
  "description": "Lifecycle of the session every authorization check is evaluated against. The check itself is one request and one response and has no state of its own.",
  "states": {
    "anonymous": {
      "description": "A reference exists and names no account. Real, storable, and enough to own a cart.",
      "entry": ["issue-reference", "start-expiry-timer"],
      "on": {
        "CREDENTIAL_VERIFIED": {
          "target": "authenticated",
          "actions": ["bind-account", "record-issued-at"],
          "description": "The same reference is bound to an account; id and created-at survive."
        },
        "RECOVERY_VERIFIED": {
          "target": "#authorization-check.authenticated.recovery",
          "actions": ["bind-account", "record-issued-at"],
          "description": "A mailbox was reached and nothing else. Bound to the account, but at the weakest strength there is."
        },
        "EXPIRY_ELAPSED": {
          "target": "expired",
          "description": "An abandoned anonymous session evicts by TTL like any other."
        },
        "IDLE_ELAPSED": {
          "target": "expired",
          "guard": "an idle policy applies to this session",
          "description": "The sliding deadline ran out before the absolute one. Same terminal state, earlier."
        },
        "REVOKE_SESSION": {
          "target": "revoked",
          "actions": ["record-revocation-reason"],
          "guard": "an operator revoked the client, not the principal"
        }
      }
    },
    "authenticated": {
      "description": "Bound to an account and inside its expiry window. Checks may now match grants.",
      "initial": "single-factor",
      "exit": ["stop-expiry-timer"],
      "on": {
        "EXPIRY_ELAPSED": {
          "target": "expired",
          "description": "Absolute deadline reached. Never extended in place — a refresh issues a new session."
        },
        "IDLE_ELAPSED": {
          "target": "expired",
          "guard": "an idle policy applies to this session",
          "description": "The effective end of a session is the earlier of the two clocks; this is the earlier one firing."
        },
        "REVOKE_SESSION": {
          "target": "revoked",
          "actions": ["record-revocation-reason", "push-invalidation"]
        },
        "ACCOUNT_ERASED": {
          "target": "revoked",
          "actions": ["record-revocation-reason", "push-invalidation"],
          "description": "A session must not outlive the account it speaks for."
        }
      },
      "states": {
        "recovery": {
          "description": "Reached only through account recovery. Credential repair is permitted; nothing that spends money or reads another principal's data is.",
          "on": {
            "CREDENTIAL_VERIFIED": {
              "target": "single-factor",
              "actions": ["record-issued-at"],
              "description": "A real factor was presented. Strength only ever increases in place."
            },
            "SECOND_FACTOR_VERIFIED": {
              "target": "multi-factor",
              "actions": ["record-issued-at"],
              "description": "Password plus factor proved together during repair; the session skips a rung rather than stepping through one."
            }
          }
        },
        "single-factor": {
          "description": "One proof presented. A permission with requires-multi-factor is denied here.",
          "on": {
            "SECOND_FACTOR_VERIFIED": {
              "target": "multi-factor",
              "actions": ["record-issued-at"],
              "description": "Elevation in place — strength changes, identity does not."
            }
          }
        },
        "multi-factor": {
          "description": "Two proofs presented. Every grant the principal holds is now reachable.",
          "on": {
            "STEP_DOWN_ELAPSED": {
              "target": "single-factor",
              "guard": "elevation window of 15 minutes has passed",
              "description": "Elevation is time-boxed; the session itself continues."
            }
          }
        }
      }
    },
    "expired": {
      "type": "final",
      "tags": ["terminal"],
      "description": "Evicted by TTL. A resolution finds nothing, and acl denies — the same answer as an unknown reference."
    },
    "revoked": {
      "type": "final",
      "tags": ["terminal", "failure"],
      "description": "Explicitly ended. The record survives its reference so the principal can be told why."
    }
  }
}
