{
  "id": "promotion-evaluation",
  "initial": "requested",
  "description": "State of one quote, as the promotion engine sees it. Not the internal state of any participant.",
  "states": {
    "requested": {
      "description": "A cart has arrived; the latency budget starts counting here.",
      "entry": ["assign-quote-id", "start-budget-timer"],
      "on": {
        "CART_ACCEPTED": {
          "target": "evaluating",
          "description": "Currency and subtotal are readable, so candidates can be selected."
        },
        "CART_MALFORMED": {
          "target": "refused",
          "actions": ["emit-problem"]
        }
      }
    },
    "evaluating": {
      "description": "Candidates are being filtered and priced inside the budget.",
      "initial": "scanning-promotions",
      "exit": ["stop-budget-timer"],
      "on": {
        "BUDGET_EXCEEDED": {
          "target": "degraded",
          "actions": ["abandon-partial-result"],
          "description": "Whatever was computed is discarded — a half-priced cart is worse than none."
        }
      },
      "states": {
        "scanning-promotions": {
          "description": "Looping automatic promos: window, segment, minimum spend, campaign budget.",
          "on": {
            "CANDIDATES_EXHAUSTED": [
              {
                "target": "validating-coupon",
                "guard": "the customer presented a code"
              },
              {
                "target": "#promotion-evaluation.quoted"
              }
            ]
          }
        },
        "validating-coupon": {
          "description": "Asking coupon-service whether the presented code may still be used.",
          "on": {
            "COUPON_VALID": {
              "target": "#promotion-evaluation.quoted",
              "actions": ["append-applied"]
            },
            "COUPON_REFUSED": {
              "target": "#promotion-evaluation.quoted",
              "actions": ["append-rejection"],
              "description": "A refused code is a rejection line, never a failed request."
            }
          }
        }
      }
    },
    "quoted": {
      "description": "A complete quote exists and is readable until it expires.",
      "on": {
        "COUPON_PRESENTED": {
          "target": "evaluating",
          "description": "A later code re-opens the evaluation against the same cart."
        },
        "COUPON_WITHDRAWN": {
          "target": "evaluating",
          "actions": ["drop-applied-coupon"],
          "description": "The customer removed a code. Re-evaluated from scratch, because an automatic promo may have lost to it."
        },
        "ORDER_PLACED": {
          "target": "committed",
          "actions": ["burn-coupon", "publish-redemption"]
        },
        "QUOTE_SUPERSEDED": {
          "target": "superseded",
          "description": "A re-quote produced a newer quote for the same cart. This one is closed without ever having been wrong."
        },
        "QUOTE_EXPIRED": {
          "target": "expired"
        }
      }
    },
    "degraded": {
      "description": "Answered without a full evaluation; fallback is set and applied is empty.",
      "on": {
        "ORDER_PLACED": {
          "target": "committed",
          "description": "The order is placed undiscounted. No redemption is published."
        },
        "QUOTE_SUPERSEDED": {
          "target": "superseded",
          "description": "The usual escape from a degraded quote: the engine recovered and a re-quote answered properly."
        },
        "QUOTE_EXPIRED": {
          "target": "expired"
        }
      }
    },
    "committed": {
      "type": "final",
      "tags": ["success"],
      "description": "The cart became an order at the quoted price; any coupon is now burnt."
    },
    "expired": {
      "type": "final",
      "tags": ["terminal"],
      "description": "Nobody converted the cart in time. Nothing was spent and nothing is owed."
    },
    "superseded": {
      "type": "final",
      "tags": ["terminal"],
      "description": "Replaced by a newer quote for the same cart. Distinct from expired: the customer is still shopping, and the basket must not say the offer lapsed."
    },
    "refused": {
      "type": "final",
      "tags": ["failure"],
      "description": "The request itself was wrong — the only outcome that is a problem document."
    }
  }
}
